{
  "schema_version": "sensei.dashboard.architect-session.v1",
  "session_id": "session.a1b2c3d4e5f6",
  "repository_domain": "github.com/globulario/sensei-dashboard",
  "architect_runtime": {
    "provider_id": "openai",
    "runtime": "codex-app-server",
    "account_mode": "chatgpt",
    "thread_id": "thread.7788",
    "resumable": true
  },
  "assurance_mode": "governed",
  "governing_snapshot": {
    "repository_domain": "github.com/globulario/sensei-dashboard",
    "revision": "8a45f3f1e237a2e83352b01fcd417a3898efe2b4",
    "revision_status": "resolved",
    "tree_digest_sha256": "111111111111111111111111111111111111111111111111111111111111111b",
    "graph_digest_sha256": "222222222222222222222222222222222222222222222222222222222222222c",
    "graph_digest_status": "resolved"
  },
  "admission_reference": {
    "admission_id": "admission.9f8e7d",
    "decision": "admitted",
    "decision_digest_sha256": "333333333333333333333333333333333333333333333333333333333333333d",
    "policy_id": "policy.default"
  },
  "lifecycle_state": "active",
  "created_at": "2026-07-25T09:00:00Z",
  "updated_at": "2026-07-25T09:15:00Z",
  "active_context": {
    "issue_ref": "issues/7",
    "pr_ref": "pull/10",
    "task_id": "task.o1.governing-contracts"
  },
  "continuity_refs": ["pull/8#issuecomment-5078811541", "pull/10#pullrequestreview-1"]
}
